{
  "source_surface": "assistant",
  "state": "staged",
  "mutation": {
    "kind": "upsert_routine_block",
    "data": {
      "id": "routine_shutdown",
      "label": "Shutdown",
      "source": "operator_declared",
      "local_timezone": "America/Denver",
      "start_local_time": "17:00",
      "end_local_time": "17:30",
      "days_of_week": [1, 2, 3, 4, 5],
      "protected": true,
      "active": true
    }
  },
  "summary": "Add a protected weekday shutdown block from 17:00 to 17:30.",
  "requires_confirmation": true,
  "continuity": "thread",
  "thread_id": "thr_planning_profile_edit_msg_123",
  "thread_type": "planning_profile_edit"
}
